Method,Winner Index,Winner Statement (truncated),In PVC
Plurality,81,"As a Christian and a conservative, I believe our laws on abortion should reflect a deep respect for ...",No
Borda,0,"Laws concerning abortion should prioritize a woman’s right to make decisions about her own body, sup...",Yes
IRV,69,"Abortion laws should prioritize a woman’s autonomy, bodily integrity, and access to safe, evidence-b...",Yes
ChatGPT,60,"Laws concerning abortion should prioritize a woman’s right to make decisions about her own body, in ...",Yes
ChatGPT+Rankings,73,Laws concerning abortion should prioritize a woman’s autonomy over her own body while ensuring acces...,No

PVC Size,50,"Indices: [0, 1, 2, 3, 5, 6, 8, 9, 10, 11, 19, 20, 21, 22, 26, 29, 32, 33, 34, 35]...",
